Title,Sentiment Score
Tony Blair Wants Us to Stop Worrying and Embrace AI,1.0
"Google and Tesla earnings, Trump talks Bitcoin, Ether ETFs: What to watch in the markets this week",1.0
‘It’s Inevitable’—Bitcoin Price Suddenly Soars On Wild Rumors Donald Trump Will Create A U.S. Bitcoin Strategic Reserve,1.0
3 Wish List Items For Crypto Investors,1.0
Business Tech Roundup: Auto Dealership Software Platform Pays $25M Ransom,1.0
"Would a Trump Win Push Bitcoin Over $100,000?",1.0
President Biden Announces Decision to Not Seek Reelection (Copy of Letter),1.0
"With Biden Out, Polymarket Favors Harris for Democratic Presidential Nominee",1.0
‘Almost’ Everyone in Crypto’s a Winner in a Second Trump Administration,1.0
BlackRock’s Spot Bitcoin ETF Investors Still Accumulating Despite Subdued Outlook,1.0
Bitcoin Retail Investor Demand Hits a Three-Year Low; Is the Bull Run Over?,1.0
Solana Traders Identify Bullish Pennant Pattern as SOL Gains 17%,1.0
State-Owned Italian Bank Completes Digital Bond Issuance Using Polygon Blockchain,1.0
How Investors Are Reacting to Biden Dropping Out,1.0
Warren Buffett once said there are 'two kinds of items people buy' to grow wealth — but only one 'really is investing',0.0
"U.S. CISA adds Adobe Commerce and Magento, SolarWinds Serv-U, and VMware vCenter Server bugs to its Known Exploited Vulnerabilities catalog",1.0
Security Affairs Malware Newsletter – Round 3,1.0
Security Affairs newsletter Round 481 by Pierluigi Paganini – INTERNATIONAL EDITION,1.0
Don’t change it!,2.0
Preferences,1.0
The Spartan Economist,1.0
Freedom of Expression,1.0
Dollar Edges Lower Following Biden’s Election Exit: Markets Wrap,1.0
Book Of Ra Casinos 2024,1.0
Scamming As A Family: Rapper Sean Kingston And His Mother Indicted On $1 Million Fraud Charges,1.0
Markets reassess ‘Trump Trade’ as Biden withdraws from race,1.0
"Here Are 5 Reasons To Be Bullish On Bitcoin, Analyst Says",1.0
Polkadot (DOT) Poised For Rally? Analyst Predicts $9.00 Breakout,1.0
"Analyst Reveals Condition For Bitcoin To Reach $71,000 – Details",1.0
ORDI Soars 26% On Solid 7-Day Run – Can It Climb Higher This Week?,1.0
AVAX Brushes Off Bearish Pressure With 11% Rally – Details,1.0
Solana Leads Crypto Rally As Expectations For A Break Above $200 Grow,1.0
"Bitcoin ETFs Surge With $384 Million Inflows, 2nd Highest This Month",1.0
Bitcoin Accumulation: Mega Whale Holdings Hit Highest Levels In 2 Years,1.5
Bitcoin Scenario: National Treasury Reserve Push Sparks $1 Million Projections,1.0
Bitcoin Vs. Ethereum: Why This Analyst Believes BTC Will Outperform ETH,1.0
Here’s Why Dogecoin And Shiba Inu Price Surged,1.0
‘It’s Inevitable’—Bitcoin Price Suddenly Soars On Wild Rumors Donald Trump Will Create A U.S. Bitcoin Strategic Reserve,1.0
Bitcoin large sellers 'exhausted' as $67K price holds,0.0
"Is Bitcoin on Track to Hit $100,000 by 2025?",1.0
In Defense Of Bitcoin Culture,1.0
Peter Brandt Reveals His Bearish Bitcoin (BTC) View,1.0
"Blue Skies Up Ahead for Bitcoin, According to Trader Who Caught 2022 BTC Bottom – Here’s His Outlook",1.0
Fidelity Wise Origin Bitcoin Fund (NYSEARCA:FBTC) Shares Up 5.1%,1.0
Kingsview Wealth Management LLC Cuts Stake in ProShares Bitcoin Strategy ETF (NYSEARCA:BITO),1.0
Grayscale Bitcoin Trust (NYSEARCA:GBTC) Trading Up 3.6%,1.0
"Bitcoin breaks $66,000: Why were liquidations surprisingly low?",0.0
ProShares Bitcoin Strategy ETF (NYSEARCA:BITO) Shares Up 3.6%,1.0
2-year high for Bitcoin’s whales – What does that mean for you?,1.0
"Bitcoin traders, here’s why you should watch out for this sell signal!",0.0
DAIM CEO Explains How Trump’s Pro-Crypto Stance Could Propel Bitcoin to New Heights,1.0
Is Ethereum a No-Brainer Buy After the Bitcoin Halving?,1.0
Ran Neuner on How Trump’s Potential Announcement at Bitcoin 2024 Could Transform the Crypto Market,1.0
Elon Musk goes laser eyes after Biden quits presidential race,1.0
Bitcoin tumbles on news of Biden’s withdrawal from election race,1.0
Crypto Liquidations Spiked After Biden's Dropout—Now Bitcoin Is Gaining,1.0
"Bitcoin Indicator Pointing Towards ‘Deep Value’ for BTC, According to ARK Invest Analysts",1.0
"Bitcoin, Ethereum, Solana and Crypto Markets Look Ready To ‘Send’ As Stars Align, According to Investor Chris Burniske",1.0
"‘The Best Is Yet To Come’ – Analyst Says Altcoins Have Bottomed Out, Predicts All-Time-High Rally for Bitcoin",1.0
"Bitcoin Price Rattles As President Biden Quits 2024 Presidential Race, Endorses Kamala Harris",1.0
Bitcoin’s big question: Is the post-halving BTC rally still on the cards?,1.0
"'Rich Dad, Poor Dad' Author Kiyosaki Drops Game-Changing Advice on When to Get Rich",1.0
RankFi Study Reveals Major Fee Discrepancies Among Canadian Crypto Exchanges,1.0
Foreign crypto firms might be the only losers under a second Trump presidency: Bloomberg,0.0
Bitcoin price 'explosive move' puts old $69K all-time high in sight,0.0
"Bitcoin, Ether, XRP, Solana, Cardano, Shiba Inu Braced For Explosive $4 Trillion Storm",1.0
Wall Street Longs for ‘Less History’ With Politics Omnipresent,1.0
"Crypto price predictions: Poodlana, Mother Iggy, Cat in a Dogs World (MEW)",1.0
HIVE Digital Technologies (CVE:HIVE) Trading Up 12.8%,1.0
"Wall Street Eyes Worst Week In 3 Months As Tech Sector Falters; Oil Falls, Bitcoin Hits 1-Month Peak: What's Driving Market Friday?",1.0
Market volatility post Joe Biden withdrawal wipes out $113M as investors flock to Poodlana,1.0
CleanSpark (NASDAQ:CLSK) Trading Up 7.7%,1.0
Solana Sets Eyes on $250 Thanks to a Major Rebound After Bottoming Out,1.0
Biden Exit Leaves Markets Asking What’s Next for ‘Trump Trade’,1.0
Shiba Inu’s slow week: Could a $48M transaction turn the tide?,1.0
"Polymarket Goes Wild as Biden Drops Out of Race, Endorses Kamala Harris",1.0
Dogwifhat sees 54% increase: A bullish signal for memecoins?,1.0
"Bleakley Financial Group LLC Makes New $33,000 Investment in Bit Digital, Inc. (NASDAQ:BTBT)",1.0
Iris Energy (NASDAQ:IREN) Shares Up 5.4%,1.0
US Futures Flat as Biden’s Exit Threatens to Upend Election Bets,1.0
Analyzing Bitdeer Technologies Group (NASDAQ:BTDR) and RocketFuel Blockchain (OTCMKTS:RKFL),1.0
Head-To-Head Review: Bilibili (NASDAQ:BILI) and BIT Mining (NYSE:BTCM),1.0
