Title,Sentiment Score
Google Strategy Doc from Antitrust Proceedings,1.0
"Bitcoin Is Better Than Gold, And Recent Market Volatility Proves It",1.0
Venezuelan Censorship Hits Binance Amid Post-Election Unrest,1.0
"Prediction: Bitcoin Will Hit $100,000 by the End of 2024",1.0
US Spot Bitcoin ETFs Record $192M in Inflows Amid Net Loss for ETH ETFs,0.0
Crooks took control of a cow milking robot causing the death of a cow,0.0
Sonos smart speakers flaw allowed to eavesdrop on users,0.0
7M horsepower,1.0
WAR CHEST,1.0
How to Become a Millionaire Blogger,1.0
You gotta keep it moving! ￼,1.0
"Bitcoin deve retornar ao nível recorde em breve, diz Grayscale",1.0
Shippingtopp hardt ut mot eget land: – Uansvarlige klimaprofitører,1.0
JD Vance Has Numerous Investments But Tim Walz Doesn't Own A Single Stock – Here's A Look At Their Dramatically Different Personal Finances,1.0
Küresel piyasalar ABD'de açıklanacak enflasyon verisine odaklandı,2.0
"Andrew Chow — Cryptomania: Hype, Hope, and the Fall of a Billion-Dollar Fintech Empire",1.0
"Andrew Chow — Cryptomania: Hype, Hope, and the Fall of a Billion-Dollar Fintech Empire",1.0
Bitcoin Set For Critical Price Resistance Encounter – Analyst,1.0
Is Bitcoin Headed For A Rally Or Ruin? This Key Price Point Could Decide,1.0
Ethereum Open Interest Drops 40% In August – What’s Happening?,1.0
"NBTC: THORChain Protocol Revenue Rises 100%, Why Is RUNE Struggling?",1.0
"KAMALA PASSA IN VANTAGGIO! – I NUOVI SONDAGGI IPSOS DANNO LA VICEPRESIDENTE AVANTI DI CINQUE PUNTI RISPETTO A DONALD TRUMP A LIVELLO NAZIONALE (42% CONTRO 37%) - SAREBBE NETTAMENTE IN VANTAGGIO ANCHE A MIAMI, NELLA ROCCAFORTE REPUBBLICANA DELLA FLORIDA - HARRIS E IL SUO VICE TIM WALZ CONTINUANO A MARTELLARE NEGLI STATI IN BILICO: DOPO PENNSYLVANIA E MICHIGAN SBARCANO IN ARIZONA, DOVE IL TEMA DELL'IMMIGRAZIONE È PROTAGONISTA INSIEME ALL'ABORTO…",2.0
Las criptomonedas resurgen de las cenizas: algunas crecieron hasta un 22% en el primer semestre,1.0
Best Betting Sites Australia (2024): Top 10 AU Online Bookmakers out of 150+,2.0
Weekend reading: a busy week here and there,1.0
Cloud spending remains resilient amid market turbulence,2.0
David Knight Interview – Fighting For Objectivity In a Partisan World Gone Mad,1.0
"Bitcoin Makes Sharp Recovery, But Watch Out For Resistance At $64,000",1.0
Grayscale Forecasts Bitcoin To Retest All-Time Highs By 2024 End If US Avoids Recession,1.0
Cronos Surprises With 12% Uptick – Can Investors Sustain The Rally?,1.0
"XRP Price Enters Wave 3, Crypto Analyst Puts Top At $36.76",1.0
Podcasts d'été : Nos recommandations,1.0
"Почему YouTube совсем перестал работать, и какова судьба анонимных Telegram-каналов? Технодайджест недели",1.0
La settimana phastidiosa – 10 agosto 2024,1.0
"Bitcoin Open Interest Plunges As BTC Crosses $60,000",1.0
Morgan Stanley Faces Heightened Regulatory Risks Following Bitcoin ETF Offer – Ex-SEC Chief,1.0
Pro-Bitcoin Politician Advocates For Investors’ Rights In Lawsuit Against Nigerian Authorities,1.0
Bitcoin Whales Load Their Bags: $1.7 Billion In BTC Flow Out Of Exchanges,1.0
USDT Soars To $115 Billion Market Cap As Tether Sets New Record,1.0
Αναλυτές για bitcoin: Μετά τον «σύντομο θάνατο» έρχεται ράλι,1.0
"Seven indicted for stealing $300K in crypto that was NYC body shop owner’s nest egg — bought Rolex, Benz",0.0
김건희 게이트(Rolex Gate) 69 (feat. 윤석열 탄핵),1.0
Will Indian investors become impacted if the US became the world’s Bitcoin superpower?,1.0
"Prediction: Bitcoin Will Hit $100,000 by the End of 2024",1.0
2x Bitcoin Strategy ETF (NYSEARCA:BITX) Shares Gap Up to $23.75,1.0
"Ancient Bitcoin Wallet Revives With Staggering 94,700% Profit: Details",1.0
‘Confident’ Bitcoin whales fuel $1.7 billion accumulation at the cost of…,1.0
California’s Santa Monica city launches Bitcoin office to bolster adoption,1.0
"Bitcoin Primed To Break Out and Explode by up to 86%, According to Analyst Kevin Svenson – Here’s the Timeline",1.0
"Bitcoin’s Volatility Is a Feature, Not a Bug, Argues MicroStrategy (NASDAQ: MSTR) Co-Founder",1.0
Is Bitcoin Really a Billionaire Maker?,1.0
"Bitcoin rebound, markets recover: Market Domination",0.0
"It’s Bitcoin’s victory as Russia, U.S. fight for crypto dominance",1.0
Cwm LLC Makes New Investment in iShares Bitcoin Trust (NASDAQ:IBIT),1.0
USDT fuels Bitcoin’s ’13th largest’ recovery – Everything you need to know,1.0
Santa Mónica inaugura Oficina Bitcoin para impulsar la economía local y generar empleos,1.0
"Five Things to Know in Crypto This Week: SEC vs. Ripple, US Jobs, and Yen Carry Trades",1.0
Here’s why it’s Ethereum vs Bitcoin in the macro capital markets now,1.0
"First Mover Americas: Bitcoin Reclaims $62K, Bulls Revisit $100K Target",1.0
‘Confident’ Bitcoin whales fuel $1.7 billion accumulation at the cost of…,1.0
"Bitcoin’s latest ‘death cross’ and what it means for its price, traders like you",1.0
AI and Bitcoin mining: A symbiotic relationship for the digital age,1.0
Conoce los mejores exchanges sin KYC de bitcoin y criptomonedas,1.0
"Bitcoin Open Interest Sees Flush As BTC Crosses $61,000",1.0
"Crypto Analyst Issues Bitcoin Alert, Says There Will Be ‘Pretty Severe Consequences’ if BTC Falls Below This Level",1.0
Ripple (XRP) superará a Bitcoin (BTC) en tasa de crecimiento: Bitget,1.0
BNB Chain Users Flee To Bitnance Token Presale for Store of Value — Crypto Gold for Holders,1.0
"Ethereum, Bitcoin ETFs face sudden outflows; Is a market shift in play now?",1.0
Will FED’s easing hint spark Bitcoin’s parabolic bull run hype?,0.0
Equipo de Kamala Harris se reúne con empresarios de criptomonedas ¿se volverá pro Bitcoin?,1.0
"Celsius sues Tether for $2.4B in Bitcoin, Tether strikes back, calls case a “shakedown”",1.0
"This Week in Coins: Bitcoin Ends in the Red, but Some Alts Survive a Crazy Week",1.0
Web2 vs. Web3 y ¿Web5?: La puja por la identidad digital,1.0
SEC Delays Decision On Hashdex’s Proposal For Combined Spot Bitcoin And Ethereum ETF,1.0
"This Week in Coins: Bitcoin Ends in the Red, but Some Alts Survive a Crazy Week",1.0
Tether Mints 1.3BN USDT Since Market Bottom: Can It Push Bitcoin Above $65K?,1.0
The 3 Best Blockchain Stocks to Buy in August 2024,1.0
"Bitcoin’s latest ‘death cross’ and what it means for its price, traders like you",1.0
I think crypto performed well in the Monday pseudo-crash,1.0
Poodlana: time is running out to buy the hottest token of 2024,1.0
Surprising Reason Why This Crypto Analyst Prefers Ripple’s XRP Over Gold As Investment,2.0
Cardano Founder Charles Hoskinson Warns: Harris Victory Equals Demise For American Crypto Sector,1.0
"OKX, gran exchange y suite financiera sin nada que envidiar a Binance",1.0
Atari Revives Its Classic ‘Breakout’ Game on Ethereum Layer-2 Base,1.0
Bitcoin’s Spent Output Profit Ratio shows volatility amid post-halving corrections,1.0
"This Layer-1 Altcoin Presents Solana-Like Opportunity, Could Be One of Fastest Horses in the Race: Raoul Pal",1.0
"Crypto Market in a ‘Beautiful Early Bull Setup,’ Says Investor Chris Burniske – But There’s a Catch",1.0
Will Cardano see a near term dip to $0.3? Keep an eye out for THIS!,1.5
"Cryptocurrency’s Popularity May Be a Double-Edged Sword, Explains Renowned Economist",1.0
SUI crypto jumps 30% in 24 hours: Is $1.17 on the cards?,1.0
"Toncoin is up, while other cryptos are down – Is $6.85 next?",1.0
Ethereum’s strong ‘lead’ on the fees front – Here’s the why and how of it all!,1.0
¿Qué es Solana y la criptomoneda SOL?,1.0
Charles Hoskinson says voting for Kamala Harris is a threat to US crypto sector,1.0
TeraWulf (WULF) Scheduled to Post Quarterly Earnings on Monday,1.0
"IRIS ENERGY LIMITED ANNOUNCEMENT: If You Have Suffered Losses in Iris Energy Limited (NASDAQ: IREN), You Are Encouraged to Contact The Rosen Law Firm About Your Rights",1.0
¿Qué es una Oferta Inicial de Moneda (ICO)?,1.0
"Cetera Investment Advisers Takes $3.70 Million Position in Marathon Digital Holdings, Inc. (NASDAQ:MARA)",1.0
CompoSecure (NASDAQ:CMPO) Sees Unusually-High Trading Volume on Analyst Upgrade,1.0
"Vanguard Group Inc. Purchases 1,764,115 Shares of TeraWulf Inc. (NASDAQ:WULF)",1.0
