Title,Sentiment Score
Trump Sparks Talks Of Bitcoin As A Strategic Reserve Asset,1.0
"Fed Chair Powell Issues ‘Critical’ Warning, Sparking Sudden $60,000 Bitcoin Price And Crypto Crash",1.0
Does Coinbase's Negative Premium Portend A Massive Rally In Bitcoin?,1.0
DAME Tax On Bitcoin Mining Threatens Energy Prices And Stability,1.0
Where The Top Six Potential Biden Replacements Land On Crypto,1.0
Alameda-backed bitcoin miner Genesis Digital Assets considers US IPO: Bloomberg,1.0
What Bitcoin and the American Dream Have in Common,1.0
Bitcoin Losing $60K Handle May Trigger Wave of ETF Liquidations: Analyst,1.0
Bitcoin Bottom Is Near as Miners Capitulating Near FTX Implosion Level: CryptoQuant,1.0
Crypto Venture Capital Market Rebound Extends Into Second Quarter: Galaxy,1.0
Bitcoin Sinks Under $61K as One Trader Sticks to $150K Prediction This Year,1.0
Pre-ETF Ether Options Trend Mirrors BTC Except for One Key Difference,1.0
First Mover Americas: Bitcoin Falls to $60K as Mt. Gox Overhang Looms,1.0
The Protocol: 'Private Jet Brandization' Is One Way Polkadot Burnt Cash,1.0
TradFi Liquidity Stress Indicator Surges. What Does It Mean for BTC?,0.5
"DeFi Tokens Plunge 10%-20%, Led by Pendle Amid Weak Crypto Price Action This Week",1.0
The Case for Crypto Index Funds,1.0
Obol Labs Forms Industry Group to Push for Decentralized Validator Technology,1.0
"Bitcoin Price Drops Amid Concerns Over Market Cycle Peak, According to Analyst",1.0
Navigating Bitcoin Script Improvement With Lightning Labs’ Ryan Gentry,1.0
"Canadians Show Strong Preference for Cash, Crypto Struggles to Gain Traction",1.0
Ripple’s Latest 200M XRP Transfer Amid Conclusion of June From Escrow Sparks Concerns,1.0
[Removed],1.0
[Removed],1.0
[Removed],1.0
Wall Street on Alert for Biden Exit as Trump-Win Trades Mount,1.0
S&P 500 Hits Fresh Peak in Run-Up to Jobs Report: Markets Wrap,1.0
LockBit group claims the hack of the Fairfield Memorial Hospital in the US,1.0
Polish government investigates Russia-linked cyberattack on state news agency,1.0
No room for error: Don’t get stung by these common Booking.com scams,0.0
Stock market today: US stocks edge up as traders mull cooler private payroll data,1.0
‘There Is Always A Way’: Black Market Network Evading Biden Admin Sanctions To Deliver High-Tech Chips To China,1.0
US Spot Bitcoin ETF Flows Reach Stagnant State – Are The Funds Overhyped?,0.0
"Bitcoin Can 'Complement Or Replace' US Dollar, Possibly In 15 Years: Jack Dorsey",1.0
Embattled Bitfarms Mines 189 Bitcoin In June Amid Ensuing Riot Platforms Clash,1.0
Most Democrats Outside Elizabeth Warren's Circle Are Pro-Crypto: Galaxy Digital CEO,1.0
Bitcoin Bottom Is Near as Miners Capitulating Near FTX Implosion Level: CryptoQuant,1.0
Best On-line casino Internet sites In the usa,1.0
Finest On-line casino No deposit Extra Codes 2024,1.0
On the web Roulette,1.0
Nostalgia Local casino Nz Deposit step one Get 20 Bonus,1.0
Greatest ten Minimal Deposit Gambling establishment Nz 2024,1.0
"Deposit step one Score 20 Gambling establishment Canada, Good Bonusdeposit step 1 Fool around with 20",1.0
Top 10 A real income Baccarat Online casinos 2024,1.0
5 Put Casino In australia 2024 Deposit 5 Score 80 Fs,1.0
Uk’s Better 5 Minimal Deposit Playing Sites In the 2024,1.0
Better Gambling games From 2024,1.0
Would be the Mr Beast Gambling enterprise Application Otherwise Giveaways Legit And you will Safe?,1.0
The biggest ransomware attacks in recent history and the groups behind them,1.0
"British Mega Bank Standard Chartered Says Bitcoin Will Hit $100,000, Here’s When",1.0
"Analyst Says Bitcoin Is Hitting Range Bottom, “Right Before The Fireworks”",1.0
"Fundstrat’s Head Of Research Says Bitcoin Will Reach $150,000, Here’s When",1.0
Kamala Horris (KAMA) Surges 1600% Amid Speculation Of Biden Exiting Presidential Race,1.0
"Experts Eye Spot Ethereum ETF Launch By Mid-July, Predict Price Rally",1.0
XRP Price Dip: Should Investors See This as a Buying Chance?,1.0
Solana ETF Applications: Are You Ready for More?,1.0
Ledger Finally Ships Stax Hardware Wallet After Months Of Delays,1.0
Blockchain Dev Sphere Introduces Bank-To-Wallet Telegram Extension,1.0
Blockchain oracle RedStone raises $15M to bring outside data into networks,0.0
Stella Assange’s Pivotal Roles For Julian,1.0
Trump Raises $331 Million in Quarter as War Chest Now Tops Biden...,1.0
"Bitcoin Price Drops Below $60,000: Key Reason Explained",1.0
Bitcoin Price Takes a Step Back: Analyzing The Recent Correction,1.0
ETH Price Dips As Ethereum ETF Approval Faces Delay,1.0
Buckle Up: Here Is Why Bitcoin Might Just Be Gearing Up For a 200% Surge,1.0
"Crypto Analyst Says Next Bitcoin Target Is $78,700 If BTC Breaks This Resistance",1.0
Market Expert Sees Big Things For LDO: $6 Price Increase On The Horizon?,1.0
Ethereum Reverses Course: Can ETH Bulls Save The Day?,1.0
"Cardano Breaks Out Of Falling Wedge Pattern, Analyst Predicts 70% Rally For ADA",1.0
Cardano (ADA) On The Rise: Exploring Upward Momentum and Bullish Prospects,1.0
"These Are The Altcoins In Buy Zone, Analytics Firm Reveals",1.0
XRP Price Attempts Bullish Decoupling Amid Major Developments,1.0
