Title,Sentiment Score
Bitcoin Bros Go Wild for Donald Trump,1.0
Edward Snowden Skeptical of Politicians at Bitcoin Conference - and Public Ledgers,1.0
New Learn-to-Earn Crypto ICO Ending in 10 Days – Invest in 99BTC Before It Sells Out,1.0
Goat-Themed Crypto Set for Explosive Growth This August – Could This Be the Next 100x Meme Coin to Watch?,1.0
"Top 3 Meme Coins Poised for a Surge in the Coming Weeks – $DADDY, $WAI, and $DAWGZ",1.0
Trump says he'll make a national Bitcoin reserve,1.0
"Tech earnings, crypto, and the Fed's interest rate decision: What to watch in the markets this week",1.5
‘Absolute Game Changer’—Congress Introduces Radical Bitcoin Bill As Trump Primes Price For A $100 Trillion Surge To Replace Gold,1.0
What Trump’s Speech Means For Bitcoin,1.0
Trump's Pro-Bitcoin Stance Could Transform America,1.0
How Both Parties Can Win At Bitcoin Policy,1.0
The Four Most Important Promises Trump Made At Bitcoin 2024,1.0
What Ether ETFs Mean For Crypto Adoption,1.0
Trailblazers Of Tech: 6 Women Leaders Shaping The Future,1.0
Bitcoin Breaks Through,1.0
"Trump, Appealing to Bitcoin Fans, Vows U.S. Will Be ‘Crypto Capital of the Planet’",1.0
Trump Goes After Miley Cyrus After Praising Her Dad Onstage,1.0
Here's the biggest news you missed this weekend,0.0
"Trump Says He’ll Make So Much Electricity, We’ll Beg Him To Stop",1.0
Donald Trump plant die Bitcoin-Revolution: Make Krypto Great Again,1.0
"Bitcoin Rallies Above $67,000 Following Trump’s Speech at The Nashville Conference",1.0
"Trump pledges national Bitcoin stockpile, to make US 'crypto capital of the planet'",1.0
"Asian Stocks Eye Early Gains Into BOJ, Fed Week: Markets Wrap",1.0
Book Review: Ellison's Essential 'Crypto Confidential',1.0
Security Affairs Malware Newsletter – Round 4,1.0
French authorities launch disinfection operation to eradicate PlugX malware from infected hosts,1.0
Security Affairs newsletter Round 482 by Pierluigi Paganini – INTERNATIONAL EDITION,1.0
US will become ‘global crypto capital’ – Trump,1.0
KING OF THE STREETS,1.0
'So disappointing!' Trump fans rebel against him after latest election statement,0.5
Trump accused of 'jingoistic fascist rhetoric' with comment about punishing flag burners,0.0
Bitcoin 2024 Recap: Freedom and Financial Autonomy,1.0
"Trump Won Sympathy of US Crypto Community, But Needs to Be Consistent - Expert",1.0
"Canada's Trudeau Part of 'Globalist Managerial Class,' Does Not Have Final Say - Brother",1.0
Donald Trump appeals to crypto investors at conference,1.0
Productive No deposit Bitcoin Casino Bonus Rules,1.0
ten Finest Australian Online casinos July,1.0
"Alabama Casinos on the internet 2024, Legit Gambling enterprises To have Al Players",1.0
Enjoy 19k+ 100 percent free Local casino games,1.0
"Greatest No deposit Gambling establishment Added bonus Requirements To own July, 2024",1.0
"No deposit Casinos Malaysia, Rating 100 percent free Loans Myr and you will Revolves",2.0
Greatest Online slots In the 2024 Real money Slot Online game,1.0
On the internet Titanic Slots Slots!,2.0
"No deposit Totally free Spins Australia, Online Pokies Having Free Revolves",1.0
100 percent free Slots Which have Bonus And you will Totally free Revolves Zero Download,1.5
Finest 100 percent free Revolves Gambling enterprises 2024,1.0
100 percent free Trial Slots Game To experience Inside United kingdom 2024,1.0
100 percent free Revolves No deposit Southern Africa 2024,1.0
[Removed],1.0
Bitcoin Miner Capitulation Comes To An End – Time To Buy BTC?,1.0
