Title,Sentiment Score
$170 Billion Selloff in Cryptocurrencies Friday as Mt. Gox Payout Looms,0.0
Top Learn-to-Earn Token Presale Now Raises $2.3 Million – Next Big Thing in Crypto?,1.0
Will This Trending Meme Coin Presale Achieve a 20x Increase at Launch?,1.0
FLOKI Price Analysis July 2024 – Could It Be the Top Meme Coin in This Coming Bull Run?,1.0
German Lawmaker Demands Strategic Overhaul Amid Bitcoin Sell-Off Chaos,1.0
‘Worst In History’—Bitcoin Suddenly Hurtling Toward A $1.9 Trillion Shock After Huge Price Crash,1.0
"Bitcoin Plunges to $54,000 as Mt. Gox Moves $2.6 Billion Worth of BTC",0.0
"Bitcoin Bulls Eye $100,000 But Political Uncertainty Looms Large",1.0
"Worried about Biden and Trump wreaking havoc on your portfolio? Oh well, there's nowhere to hide!",1.0
Live: ASX to slip on opening despite Wall Street closing again at record highs,1.0
Security Affairs newsletter Round 479 by Pierluigi Paganini – INTERNATIONAL EDITION,1.0
Apache fixed a source code disclosure flaw in Apache HTTP Server,0.0
Security Affairs Malware Newsletter – Round 1,1.0
Alabama State Department of Education suffered a data breach following a blocked attack,0.0
AMAP (As Minimal as Possible),1.0
Which movie items live in your mind rent free?,1.0
An informed Mobile Gambling enterprises You to definitely Deal with Bitcoin,1.0
"Best United kingdom No deposit Incentives 5, ten, 15 And more Summer 2024",0.0
Do you know the Reduced Lowest Deposit Gambling enterprises?,1.0
Finest Real money On-line casino Internet sites Inside 2024,1.0
Simple tips to Capture An inexpensive Legit Screen 7 Otherwise 8 Licenses Now for 100 percent free Modify In order to Screen ten,1.5
Is Bonanza Legitimate? Bonanza View Here are a few Before Have fun with!,1.5
Sloto’cash Bonuses,1.0
Finest Web based casinos Canada 2024,1.0
Jilibay Casino games Having 300percent Invited Bonus,1.0
100percent Separate and you will Top On-line casino Recommendations Summer,2.0
Greatest On the web Fl Gambling enterprises,1.5
Finest Us Real cash On-line casino Web sites Summer 2024,1.0
Play Totally free Casino games Online,2.0
"southern area African Web based casinos 2024, Greatest Gambling on line Websites",1.0
Enjoy Today Shell out After Gambling enterprise,1.0
Finest 10 Real cash Online casinos United states,1.0
Finest 20 Deposit Extra Gambling enterprises In the United kingdom,1.0
Pleased Larrys It Contact form Lobstermania step 3 Download free,1.0
100percent Independent and you will Trusted On-line casino Analysis Summer,2.0
The new No deposit Casinos 2024 No deposit Added bonus Gambling enterprise British,1.0
Speak about The fresh Exciting Arena of Online casinos,1.5
Finest Casinos on the internet Southern area Africa 2024,1.0
Pay By Mobile Harbors,1.0
No-deposit Gambling enterprise Bonus Codes To possess Established Participants,1.0
Finest United states Local casino Software For real Money Cellular Games 2024,1.0
Better Us Real cash On the web Craps Casinos Inside the 2024,1.0
"Online Black-jack 100 percent free Video game Teacher, Learn how to Number Cards",1.0
$2.4 Billion Worth Of Bitcoin Exit The Network As Bear Market Bites,1.0
Crypto hacking thefts double to US$1.4 billion,1.0
Bitcoin Critic Calls ‘Institutional Demand’ A Myth Following Recent Price Slump,1.0
"Bitcoin Strikes A Chord At The Bottom, But Can It Clear This Major Resistance?",1.0
Analyst Hints Bitcoin Price Recovery Might Be Underway — Here’s Why,1.0
Wall Street Wizard Sees Major Bitcoin ‘Buy Signal’ – Prepare For Liftoff?,1.0
Bitcoin Spot ETFs Witness Month-High Inflow Following Latest Market Downturn,1.0
Why The US And German Government Selling Bitcoin Isn’t A Big Deal,1.0
Bitcoin Cycle Peak: How The USDT Dominance Could Predict The Top,1.0
"Shiba Inu Whales On The Move Again As Bitcoin, Crypto Market Recover",1.0
"Justin Sun To Launch Gas-Free Stablecoin Transfer On Tron, Other Networks",1.0
"Analyst Sparks Heated Debate By Calling Cardano, Polkadot ‘Dead To Institutions’",1.0
'Worst In History'—Bitcoin Suddenly Hurtling Toward A $1.9 Trillion Shock After Huge Price Crash,1.0
Bitcoin whales ‘buy the dip’ to leave retail investors…,1.0
Bitcoin Analyst Explains Why Traders Who Want To Long BTC With Leverage Should Not Buy BTC Futures,0.0
"Crypto funding rates take a dip – How will Bitcoin, Ethereum be impacted?",1.0
Legendary Trader Peter Brandt Highlights Major Bitcoin Problem,1.0
Silent $8 Million Bitcoin Whale Awakens and Does This,1.0
Satoshi Nakamoto Iconic Bitcoin Line Marks 14 Years: Details,1.0
CryptoQuant CEO Says Bitcoin Bull Market Will Continue Until Next Year – Here’s His Price Target,1.0
Top Trader Warns of November 2018-Style Capitulation for Bitcoin After ‘Massive Range Breakdown’,1.0
"Bitcoin OTC desk balances hit over 300,000 BTC",0.0
Mission Wealth Management LP Takes Position in Grayscale Bitcoin Trust (NYSEARCA:GBTC),1.0
Grayscale Bitcoin Trust (NYSEARCA:GBTC) Stock Price Down 7.5%,1.0
"Bitcoin: 10,000 BTC Wallets Pack 212,450 BTC to Scale 6 Year High",1.0
Bitcoin decouples from stocks: Was Germany’s BTC sale the trigger?,1.0
Bitcoin: Michael Saylor has THIS to say about BTC’s volatility,1.0
Bitcoin whales ‘buy the dip’ to leave retail investors…,1.0
$BTC: Prominent Analyst on Crypto Whales’ Appetite for Bitcoin Amid Market Shakeouts,1.0
"Ancient Bitcoin Whales Wake Up From Slumber To Move Over $58,000,000 in BTC After a Decade: On-Chain Data",1.0
"Ethereum Altcoins Guaranteed to Rally 180% Soon Against Bitcoin, Analysts Show Timeline | Bitcoinist.com",1.0
Past vs. Present — Examining Bitcoin's History of Bull Market Corrections – Featured Bitcoin News,1.0
iShares Bitcoin Trust (NYSEARCA:IBIT) Sees Unusually-High Trading Volume,1.0
German Govt Transfers Another 700 Bitcoin Amid Price Recovery,1.0
Is Solana a No-Brainer Buy After the Bitcoin Halving?,1.0
"1 Top Cryptocurrency to Buy Before It Soars 150% in the Second Half of the Year, According to a Pair of Wall Street Analysts",1.0
Bankrupt Crypto Exchange Repayments Shakes the Bitcoin Market,1.0
This Week In Coins: Bitcoin’s Bad Week Sinks the Crypto Fleet,1.0
German Lawmaker Demands Strategic Overhaul Amid Bitcoin Sell-Off Chaos,1.0
"Crypto funding rates take a dip – How will Bitcoin, Ethereum be impacted?",1.0
Bitcoin bottom in? Here’s what on-chain data says,1.0
Bitcoin tanks as Mt. Gox begins repaying creditors,0.0
12-Year Dormant Bitcoin Address Suddenly Springs To Life As BTC Nosedives Under $58K,1.0
5 bullish arguments that Bitcoin price just bottomed at $53K,0.0
"Trader Predicts 400% Bitcoin Rally Following Correction, Says Short-Term BTC Pain Could Lead to Long-Term Gain",1.0
Could Poodlana become the next big meme coin?,1.0
